{
  "empty_means": "",
  "hidden-div-for-image-only-field": false,
  "max-size": false,
  "min-size": false,
  "zdefaults": {
    "width": "",
    "height": "",
    "min-width": "",
    "min-height": "",
    "max-width": "",
    "max-height": "",
    "Apply to all notes": true,
    "Apply to all fields": true
  },
  "zzimage-occlusion-field-position": [3, 4, 10, 11],
  "zzimage-occlusion-hidden-div": true,
  "zzimage-occlusion-id-field": "ID (hidden)",
  "zzimage-occlusion-note-type": "Image Occlusion Enhanced"
}
